{
  "$schema": "https://json-schema.org/draft/2020-12/schema",
  "title": "narratr scenes",
  "description": "The contract between Claude and the renderer. Claude produces this; every stage after it is deterministic. The document it is written from is arbitrary, so this file is treated as untrusted input: every string is bounded and anything that reaches a selector, a path or a subprocess argument is constrained to a charset.",
  "type": "object",
  "required": [
    "version",
    "source",
    "coverage",
    "scenes"
  ],
  "additionalProperties": false,
  "properties": {
    "version": {
      "const": 1
    },
    "source": {
      "type": "object",
      "required": [
        "title",
        "block_ids"
      ],
      "additionalProperties": false,
      "properties": {
        "title": {
          "type": "string",
          "minLength": 1,
          "maxLength": 200,
          "description": "Becomes the run directory name, so it is held under a single filesystem component."
        },
        "origin": {
          "type": "string",
          "maxLength": 2000,
          "description": "notion url, file path, or 'inline'"
        },
        "block_ids": {
          "type": "array",
          "description": "Every leaf block in the source document. Pass 1 must map all of them.",
          "items": {
            "type": "string",
            "minLength": 1,
            "maxLength": 200
          },
          "minItems": 1,
          "maxItems": 2000
        }
      }
    },
    "coverage": {
      "type": "object",
      "description": "block_id -> scene_id. Validated as a hard gate before any compute is spent.",
      "maxProperties": 2000,
      "propertyNames": {
        "maxLength": 200
      },
      "additionalProperties": {
        "type": "string",
        "maxLength": 200
      }
    },
    "voice": {
      "type": "object",
      "additionalProperties": false,
      "properties": {
        "reference": {
          "type": "string",
          "maxLength": 500,
          "description": "path to a 10s reference clip. Containment under the repo is enforced in Python, not here."
        },
        "seed": {
          "type": "integer",
          "minimum": 0,
          "maximum": 4294967295,
          "description": "Passed to torch.manual_seed, which rejects values outside its 64-bit range -- after the model has already loaded."
        },
        "speed": {
          "type": "number",
          "exclusiveMinimum": 0,
          "maximum": 4,
          "default": 0.92,
          "description": "playback tempo; below 1 is slower. Defaults to 0.92, which suits following rather than skimming. Pitch is unchanged and narration is not regenerated."
        }
      }
    },
    "theme": {
      "type": "object",
      "additionalProperties": false,
      "description": "Deck colours and fonts. Ignored by the video renderer. Fonts should be Google Fonts so Google Slides does not substitute them.",
      "properties": {
        "background": {
          "$ref": "#/$defs/colour"
        },
        "text": {
          "$ref": "#/$defs/colour"
        },
        "muted": {
          "$ref": "#/$defs/colour"
        },
        "accents": {
          "type": "array",
          "minItems": 4,
          "maxItems": 6,
          "items": {
            "$ref": "#/$defs/colour"
          }
        },
        "headingFont": {
          "type": "string",
          "minLength": 1,
          "maxLength": 100
        },
        "bodyFont": {
          "type": "string",
          "minLength": 1,
          "maxLength": 100
        }
      }
    },
    "scenes": {
      "type": "array",
      "minItems": 1,
      "maxItems": 200,
      "items": {
        "type": "object",
        "required": [
          "id",
          "type",
          "narration"
        ],
        "additionalProperties": false,
        "properties": {
          "id": {
            "type": "string",
            "pattern": "^[a-z0-9_-]+$",
            "maxLength": 100
          },
          "type": {
            "enum": [
              "prose",
              "diagram",
              "code",
              "flow",
              "cards",
              "image"
            ],
            "description": "Each type needs its own field: 'diagram' needs 'mermaid', 'code' needs 'code', 'flow' needs 'steps', 'cards' needs 'cards'. 'prose' needs nothing beyond narration -- a heading alone is a section card. 'image' needs 'image' and is decks only. That requirement is enforced in narratr.spec, which names the scene and the missing field."
          },
          "narration": {
            "type": "string",
            "minLength": 1,
            "maxLength": 5000,
            "description": "Spoken text. This is the master clock: its rendered duration sets the scene length. 5000 characters is roughly eight minutes of speech for one scene, far past the 30-60s a scene is written for."
          },
          "heading": {
            "type": "string",
            "maxLength": 200
          },
          "bullets": {
            "type": "array",
            "maxItems": 6,
            "description": "Fragments, never sentences. Six objects max per slide. Each carries the narration phrase it appears on.",
            "items": {
              "type": "object",
              "required": [
                "text",
                "cue"
              ],
              "additionalProperties": false,
              "properties": {
                "text": {
                  "type": "string",
                  "minLength": 1,
                  "maxLength": 300
                },
                "icon": {
                  "type": "string",
                  "minLength": 1,
                  "maxLength": 100,
                  "description": "Lucide icon name, kebab-case. Validated against the installed pack before any compute."
                },
                "state": {
                  "enum": [
                    "struck"
                  ],
                  "description": "struck: the approach being rejected. Dimmed with a line through it."
                },
                "cue": {
                  "type": "string",
                  "minLength": 1,
                  "maxLength": 300,
                  "description": "Verbatim phrase from this scene's narration. The element appears as the phrase begins, instead of on a guessed clock. Required: narratr validate rejects a revealed element without one, and rejects a phrase that is not in the narration. Cues must appear in reveal order."
                }
              }
            }
          },
          "mermaid": {
            "type": "string",
            "maxLength": 20000,
            "description": "diagram scenes only. Handed to mermaid-cli as a subprocess input, so it is bounded here."
          },
          "revealSteps": {
            "type": "array",
            "description": "Groups of SVG node ids revealed as beats across the scene.",
            "maxItems": 20,
            "items": {
              "type": "array",
              "maxItems": 100,
              "items": {
                "type": "string",
                "maxLength": 100,
                "pattern": "^[A-Za-z0-9_-]+$",
                "description": "A Mermaid node id. Interpolated into a CSS attribute selector by the renderer, so it is held to the charset Mermaid itself allows for node ids -- the same charset as scenes[].id."
              }
            }
          },
          "code": {
            "type": "string",
            "maxLength": 20000,
            "description": "code scenes only. Highlighted by Shiki and laid out on one slide; 20000 characters is already far more than a slide can show."
          },
          "lang": {
            "type": "string",
            "maxLength": 40,
            "pattern": "^[a-zA-Z0-9#+._-]+$",
            "description": "Shiki language id, e.g. 'python', 'c#', 'objective-c'. Not enumerated -- Shiki supports hundreds and an enum would go stale -- but constrained to the shape a language id has."
          },
          "steps": {
            "type": "array",
            "minItems": 2,
            "maxItems": 5,
            "description": "flow scenes. A sequence, revealed one step at a time. Beyond five steps it is a diagram.",
            "items": {
              "type": "object",
              "required": [
                "icon",
                "label",
                "cue"
              ],
              "additionalProperties": false,
              "properties": {
                "icon": {
                  "type": "string",
                  "minLength": 1,
                  "maxLength": 100,
                  "description": "Lucide icon name, kebab-case."
                },
                "label": {
                  "type": "string",
                  "minLength": 1,
                  "maxLength": 300,
                  "description": "A word or two under the icon."
                },
                "cue": {
                  "type": "string",
                  "minLength": 1,
                  "maxLength": 300,
                  "description": "Verbatim phrase from this scene's narration. The element appears as the phrase begins, instead of on a guessed clock. Required: narratr validate rejects a revealed element without one, and rejects a phrase that is not in the narration. Cues must appear in reveal order."
                }
              }
            }
          },
          "footer": {
            "type": "object",
            "required": [
              "icon",
              "label"
            ],
            "additionalProperties": false,
            "properties": {
              "icon": {
                "type": "string",
                "minLength": 1,
                "maxLength": 100,
                "description": "Lucide icon name, kebab-case."
              },
              "label": {
                "type": "string",
                "minLength": 1,
                "maxLength": 300,
                "description": "A word or two under the icon."
              }
            },
            "description": "flow scenes. The condition holding across every step, shown below the chain."
          },
          "cards": {
            "type": "array",
            "minItems": 2,
            "maxItems": 4,
            "description": "cards scenes. Parallel things side by side, revealed one at a time.",
            "items": {
              "type": "object",
              "required": [
                "title",
                "cue"
              ],
              "additionalProperties": false,
              "properties": {
                "icon": {
                  "type": "string",
                  "minLength": 1,
                  "maxLength": 100,
                  "description": "Lucide icon name, kebab-case."
                },
                "title": {
                  "type": "string",
                  "minLength": 1,
                  "maxLength": 300
                },
                "detail": {
                  "type": "string",
                  "maxLength": 300,
                  "description": "One short line. Never a sentence."
                },
                "cue": {
                  "type": "string",
                  "minLength": 1,
                  "maxLength": 300,
                  "description": "Verbatim phrase from this scene's narration. The element appears as the phrase begins, instead of on a guessed clock. Required: narratr validate rejects a revealed element without one, and rejects a phrase that is not in the narration. Cues must appear in reveal order."
                },
                "image": {
                  "$ref": "#/$defs/image"
                }
              }
            }
          },
          "image": {
            "$ref": "#/$defs/image",
            "description": "prose scenes: a picture beside the bullets. image scenes: the whole slide."
          },
          "caption": {
            "type": "string",
            "maxLength": 300,
            "description": "image scenes. One line under the picture."
          },
          "revealCues": {
            "type": "array",
            "description": "diagram scenes. One narration phrase per revealSteps group, in the same order: group i appears as revealCues[i] is spoken.",
            "maxItems": 20,
            "items": {
              "type": "string",
              "minLength": 1,
              "maxLength": 300,
              "description": "Verbatim phrase from this scene's narration. The element appears as the phrase begins, instead of on a guessed clock. Required: narratr validate rejects a revealed element without one, and rejects a phrase that is not in the narration. Cues must appear in reveal order."
            }
          }
        }
      }
    }
  },
  "$defs": {
    "colour": {
      "type": "string",
      "pattern": "^#[0-9a-fA-F]{6}$"
    },
    "image": {
      "type": "string",
      "minLength": 1,
      "maxLength": 1000,
      "description": "Path to a PNG, JPEG or GIF, relative to this spec file. Decks only: the video renderer refuses a spec that uses one."
    }
  }
}
